{
  "schema": "pulsetensor/task-spec/v1",
  "taskVersion": "1",
  "chainId": 943,
  "settlementContract": "0x1111111111111111111111111111111111111111",
  "taskId": "0xaaaaaaaaaaaaaaaaaaaaaaaaaaaaaaaaaaaaaaaaaaaaaaaaaaaaaaaaaaaaaaaa",
  "payer": "0x2222222222222222222222222222222222222222",
  "requester": "0x2222222222222222222222222222222222222222",
  "requesterRefundRecipient": "0x3333333333333333333333333333333333333333",
  "provider": "0x4444444444444444444444444444444444444444",
  "netuid": 1,
  "mechid": 0,
  "mechanismVersion": 1,
  "taskType": "GUARDIAN_TX_SIMULATION",
  "inputCommitment": "0xbbbbbbbbbbbbbbbbbbbbbbbbbbbbbbbbbbbbbbbbbbbbbbbbbbbbbbbbbbbbbbbb",
  "inputAvailabilityPolicyHash": "0xcccccccccccccccccccccccccccccccccccccccccccccccccccccccccccccccc",
  "canonicalSemanticsId": "0xdddddddddddddddddddddddddddddddddddddddddddddddddddddddddddddddd",
  "outputSchemaHash": "0xeeeeeeeeeeeeeeeeeeeeeeeeeeeeeeeeeeeeeeeeeeeeeeeeeeeeeeeeeeeeeeee",
  "assuranceMode": "STATISTICAL",
  "verifierPolicyHash": "0xffffffffffffffffffffffffffffffffffffffffffffffffffffffffffffffff",
  "evaluationPolicyHash": "0x0101010101010101010101010101010101010101010101010101010101010101",
  "evaluatorCommitteeRoot": "0x0404040404040404040404040404040404040404040404040404040404040404",
  "paymentAsset": {
    "assetId": "0xb4437914122850bf50ae4e03bbd0b893489fb288c743789b186ec42d283f70e7",
    "kind": "NATIVE_PLS",
    "chainId": 943,
    "token": "0x0000000000000000000000000000000000000000"
  },
  "contributionRoot": "0x0505050505050505050505050505050505050505050505050505050505050505",
  "fundedAmount": "1000000",
  "providerBondAmount": "500000",
  "evaluatorBondAmount": "100000",
  "feeScheduleHash": "0x0303030303030303030303030303030303030303030303030303030303030303",
  "deadlines": {
    "assignment": "1000",
    "submission": "1100",
    "evaluationCommit": "1150",
    "evaluationReveal": "1200",
    "challenge": "1300",
    "claim": "2000"
  },
  "payerNonce": "7",
  "payerAuthorization": "0x1111111111111111111111111111111111111111111111111111111111111111111111111111111111111111111111111111111111111111111111111111111111"
}
